{
  "task_id": "task-001",
  "source_request": "Improve the landing page hero section so the product feels clearer and more credible without redesigning the whole site.",
  "objective": "Improve clarity and credibility of the landing page hero section without changing overall product positioning.",
  "deliverable": "A bounded hero-section improvement proposal suitable for specialist delegation and later execution review.",
  "constraints": [
    "Limit scope to the landing page hero section.",
    "Do not redesign the full site.",
    "Do not invent new product features.",
    "Do not change pricing, branding, or core product positioning."
  ],
  "non_goals": [
    "Full homepage redesign",
    "Pricing strategy changes",
    "Brand overhaul",
    "New feature definition"
  ],
  "acceptance_criteria": [
    "Hero section value proposition is clearer.",
    "At least two credibility/trust improvements are identified.",
    "Changes remain limited to the approved scope.",
    "No new product claims are introduced."
  ],
  "risk_level": "medium",
  "assigned_specialist": "iteration",
  "tool_policy": {
    "allowed_tools": [
      "patch_proposal",
      "ui_improvement_proposal"
    ],
    "disallowed_tools": [
      "architecture_redesign",
      "unapproved_scope_expansion"
    ],
    "internet": "off",
    "file_mutation": "restricted",
    "allowed_paths": [
      "frontend/",
      "ui/",
      "landing/"
    ],
    "background_execution": "off"
  },
  "escalation_triggers": [
    "Hero section files cannot be identified confidently.",
    "Required change expands beyond approved scope.",
    "Credibility improvement requires product-positioning changes."
  ],
  "created_at": "2026-03-20T12:00:00Z"
}
